{
  "schema_version": "1.1",
  "document_id": "doc-746047a26373c668",
  "status": "partial",
  "source": {
    "type": "image"
  },
  "pages": [
    {
      "page_id": "p0001",
      "page_index": 0,
      "raster_size": [
        1654,
        2339
      ],
      "coordinate_space": "raster_page",
      "status": "partial",
      "reading_order": [
        "b0005",
        "b0006"
      ],
      "layout_blocks": [
        {
          "id": "l0005",
          "page_id": "p0001",
          "label": "formula",
          "bbox": [
            275,
            379,
            1301,
            418
          ],
          "coordinate_space": "raster_page",
          "detection_score": 0.838539302,
          "candidate_rank": 26,
          "original_class_id": 5,
          "candidate_id": 8,
          "mask_row": 8,
          "mask_nonzero": 496,
          "model_label": "formula",
          "original_bbox": [
            275.347687,
            379.590363,
            1300.658081,
            417.783386
          ],
          "clamped": false,
          "provenance": {
            "model_profile": "MNN/3.6.1/PP-DocLayoutV3=5f1a43441d70f6843012b47eb294bed7edd3d0ef2344f0074700a38cb2e29c67/OvisOCR2=f09832b6ee9d63167ef456e83dea7f5df28e3983953e28b0a1e63e598cb45d32/RuntimeConfig=2562851de14afaf74cbd869de0d062ccab8a03c1c2a4264251c65a24244fb2c6",
            "request_id": "layout-p0001"
          }
        },
        {
          "id": "l0006",
          "page_id": "p0001",
          "label": "text",
          "bbox": [
            274,
            441,
            731,
            479
          ],
          "coordinate_space": "raster_page",
          "detection_score": 0.806293428,
          "candidate_rank": 31,
          "original_class_id": 22,
          "candidate_id": 22,
          "mask_row": 22,
          "mask_nonzero": 165,
          "model_label": "text",
          "original_bbox": [
            274.388245,
            441.027924,
            730.11322,
            478.069916
          ],
          "clamped": false,
          "provenance": {
            "model_profile": "MNN/3.6.1/PP-DocLayoutV3=5f1a43441d70f6843012b47eb294bed7edd3d0ef2344f0074700a38cb2e29c67/OvisOCR2=f09832b6ee9d63167ef456e83dea7f5df28e3983953e28b0a1e63e598cb45d32/RuntimeConfig=2562851de14afaf74cbd869de0d062ccab8a03c1c2a4264251c65a24244fb2c6",
            "request_id": "layout-p0001"
          }
        },
        {
          "id": "l0067",
          "page_id": "p0001",
          "label": "formula",
          "bbox": [
            311,
            444,
            572,
            478
          ],
          "coordinate_space": "raster_page",
          "detection_score": 0.72723037,
          "candidate_rank": 42,
          "original_class_id": 15,
          "candidate_id": 27,
          "mask_row": 27,
          "mask_nonzero": 96,
          "model_label": "formula",
          "original_bbox": [
            311.202148,
            444.431305,
            571.961975,
            477.140564
          ],
          "clamped": false,
          "provenance": {
            "model_profile": "MNN/3.6.1/PP-DocLayoutV3=5f1a43441d70f6843012b47eb294bed7edd3d0ef2344f0074700a38cb2e29c67/OvisOCR2=f09832b6ee9d63167ef456e83dea7f5df28e3983953e28b0a1e63e598cb45d32/RuntimeConfig=2562851de14afaf74cbd869de0d062ccab8a03c1c2a4264251c65a24244fb2c6",
            "request_id": "layout-p0001"
          }
        }
      ],
      "regions": [
        {
          "id": "r0005",
          "page_id": "p0001",
          "source_layout_block_ids": [
            "l0005"
          ],
          "bbox": [
            275,
            379,
            1301,
            418
          ],
          "coordinate_space": "raster_page"
        },
        {
          "id": "r0006",
          "page_id": "p0001",
          "source_layout_block_ids": [
            "l0006",
            "l0067"
          ],
          "bbox": [
            274,
            441,
            731,
            479
          ],
          "coordinate_space": "raster_page"
        }
      ],
      "blocks": [
        {
          "id": "b0005",
          "page_id": "p0001",
          "type": "formula",
          "source_region_ids": [
            "r0005"
          ],
          "bbox": [
            275,
            379,
            1301,
            418
          ],
          "coordinate_space": "raster_page",
          "geometry_granularity": "region",
          "reading_order_source": "geometry",
          "status": "ok",
          "confidence": null,
          "content": {
            "format": "latex",
            "text": "e^{\\alpha}x\\left[\\left(A_{1}+A_{2}x+\\cdots+A_{k}x^{k-1}\\right)\\cos\\beta x+\\left(B_{1}+B_{2}x+\\cdots+B_{k}x^{k-1}\\right)\\sin\\beta x\\right]",
            "resource": "assets/p0001-b0005.png",
            "display": true
          },
          "provenance": {
            "model_profile": "MNN/3.6.1/PP-DocLayoutV3=5f1a43441d70f6843012b47eb294bed7edd3d0ef2344f0074700a38cb2e29c67/OvisOCR2=f09832b6ee9d63167ef456e83dea7f5df28e3983953e28b0a1e63e598cb45d32/RuntimeConfig=2562851de14afaf74cbd869de0d062ccab8a03c1c2a4264251c65a24244fb2c6",
            "request_id": "reqr0005",
            "raw_output": "$$ e^{\\alpha}x\\left[\\left(A_{1}+A_{2}x+\\cdots+A_{k}x^{k-1}\\right)\\cos\\beta x+\\left(B_{1}+B_{2}x+\\cdots+B_{k}x^{k-1}\\right)\\sin\\beta x\\right] $$\n",
            "raw_output_base64": null,
            "text_base64": null
          },
          "error": null,
          "error_base64": null
        },
        {
          "id": "b0006",
          "page_id": "p0001",
          "type": "text",
          "source_region_ids": [
            "r0006"
          ],
          "bbox": [
            274,
            441,
            731,
            479
          ],
          "coordinate_space": "raster_page",
          "geometry_granularity": "region",
          "reading_order_source": "geometry",
          "status": "ok",
          "confidence": null,
          "content": {
            "format": "markdown",
            "text": "若 $\\lambda_{1,2}=\\alpha\\pm\\beta i,\\beta>0$ 为特征方程\n",
            "resource": "assets/p0001-b0006.png"
          },
          "provenance": {
            "model_profile": "MNN/3.6.1/PP-DocLayoutV3=5f1a43441d70f6843012b47eb294bed7edd3d0ef2344f0074700a38cb2e29c67/OvisOCR2=f09832b6ee9d63167ef456e83dea7f5df28e3983953e28b0a1e63e598cb45d32/RuntimeConfig=2562851de14afaf74cbd869de0d062ccab8a03c1c2a4264251c65a24244fb2c6",
            "request_id": "reqr0006",
            "raw_output": "若 $\\lambda_{1,2}=\\alpha\\pm\\beta i,\\beta>0$ 为特征方程\n",
            "raw_output_base64": null,
            "text_base64": null
          },
          "error": null,
          "error_base64": null
        }
      ],
      "relations": [
        {
          "type": "content_owned_by",
          "source_layout_block_id": "l0067",
          "owner_block_id": "b0006"
        }
      ]
    }
  ],
  "resources": [
    {
      "id": "asset-b0005",
      "path": "assets/p0001-b0005.png",
      "media_type": "image/png",
      "source_block_id": "b0005",
      "width": 1026,
      "height": 39,
      "bbox": [
        275,
        379,
        1301,
        418
      ],
      "coordinate_space": "raster_page"
    },
    {
      "id": "asset-b0006",
      "path": "assets/p0001-b0006.png",
      "media_type": "image/png",
      "source_block_id": "b0006",
      "width": 457,
      "height": 38,
      "bbox": [
        274,
        441,
        731,
        479
      ],
      "coordinate_space": "raster_page"
    }
  ]
}
